rating,review,image_url
5/5,It is a wonderful place filled with beautiful and accomodating people. Only the best quality and services are available,[]
5/5,"Very nice environment, delicious meals and all, but they have unacceptable way on confirming payments. Very unacceptable.",[]
4/5,Beautiful place. Staff are friendly and seem very interested in your wellbeing.,[]
5/5,"Another amazing 5 star rated hotel for me, absolutely classic, amazing views, top notch rooms and super styled beautiful environment.","['https://lh5.googleusercontent.com/p/AF1QipNRf7Q0-zfCgywzXVT7wMGO1BNEw7W_5I-rGtNC=w150-h150-k-no-p', 'https://lh5.googleusercontent.com/p/AF1QipMRrZhwI1ix0GRe6LyU80DtJrH8mY0FgajEM4Bk=w150-h150-k-no-p', 'https://lh5.googleusercontent.com/p/AF1QipOrb156Nt_IUXL2T6BwHqwYzDLLjpH7VPtOwSTM=w150-h150-k-no-p', 'https://lh5.googleusercontent.com/p/AF1QipOHazH94l5Q1UpFcZS5QrvIJBeh-ggO8Va_Cc4P=w150-h150-k-no-p']"
4/5,The place is easy to locate. It's immediately after Lekki tollgate. It's spacious car park and security.,[]
5/5,"Great customer service, nice ambiance but expensive for an average, salary earner Nigerian. Aside the expenses, it's a lovely place",[]
5/5,"Always cool, went to the Chinese restaurant for lunch. Enjoyed my meal","['https://lh5.googleusercontent.com/p/AF1QipPQUB-eSXcmlRybsQVFM0M-j1NcPq5OZssB7bvY=w150-h150-k-no-p', 'https://lh5.googleusercontent.com/p/AF1QipPKsEuxnjgQtMImto6XfndJNkwODr5iuk1--YFq=w150-h150-k-no-p']"
4/5,Chinese themed hotel. Large spaces nice ball room. Some Rooms have fantastic view of the Lagos lagoon. Facilities basic though,[]
5/5,"I was at Oriental for a concert ""Pure vibes with Made Kuti and the movement"".  He featured The Cavemen and The Bandhitz.A wonderful night with awesome and unique sounds.",[]
4/5,Ambience is sheer opulence.The response time of the staff is fantasticI'd love to return here for my events,[]
5/5,The best I have been to!! Infact words ain't just enough but you must be fully loaded to enjoy the place!,[]
5/5,"Oriental is a beautiful hotel. I have attended events there, and almost everything is on point. Decor, staff, etc",[]
5/5,"Hmmm.. Massive... Was at the snooker place, as well as patronized one of their eateries. The meal was topsy even at an unexpectedly cheap price",[]
5/5,Had a fun filled moment on my stay. Great one,[]
5/5,Oriental hotel is the place to be especially hot pot Korean restaurant because their food is super delicious.,[]
5/5,Lovely place and nice architecture,[]
3/5,The Orientak is big enough for large conferences and wedding events. The hong kong style chinese restaurant is good as well. But the toilets need to look and smell much better.,[]
4/5,"Architectural master piece, great scenery for photos, cosmopolitan, lovely Sunday buffet with space for the children to run around, courteous personnel.. hmmm, list is endless!",[]
4/5,"A nice place, has a water front view and sit out . Good for entertainment and meetings. Pricing is a bit high .",[]
5/5,Great reception. Good food too!  I was there for a wedding at the Grand Ballroom! It was beautiful.,[]
5/5,Elegant and classy property... Great choice for a vacation stay and awesome dining. Thanks to Taiwo and Phil. Great staff.,[]
5/5,Wonderful place to be,[]
5/5,"Just there media wise, thats the only thing that brings me here, aside this is a fantastic place to be",[]
5/5,Best buffet experience so far in lagos expensive though but it was worth it,"['https://lh5.googleusercontent.com/p/AF1QipMsmcNpbT9lYcrzFJo4bl_aTAbio-ky4rn6RB9L=w150-h150-k-no-p', 'https://lh5.googleusercontent.com/p/AF1QipPJ7Whp-WPkO2zi0UYpWvCy6ZT7tB9xqea7y_rn=w150-h150-k-no-p']"
4/5,Organized a 3 days fashion show and it was beautiful. services were good and the personnel were responsive.,[]
5/5,It is a place to be. Calm and organized environment. A place for kings.,[]
5/5,I went to oriki Spa. Service was great and everything was organised,[]
5/5,"Exquisite environment, clean rooms, good food and secure.",[]
5/5,Clean and crisp environment. Good service too.,[]
5/5,Great Ambience for an Award Ceremony. Very polite staff but not too flexible with terms of use.,['https://lh5.googleusercontent.com/p/AF1QipOcKrZEggRcbPJLFkKJY5UUXeiTGba5iIh6dzZU=w150-h150-k-no-p']
5/5,"I never hated Oriental Hotel, its one of the best Hotels we have here in Nigeria, with a very beautiful ocean view.",[]
5/5,Ambience and professionalism are topnotch. Buffet breakfast is quite affordable as it cost only 6000 Naira in Oct 2018 and is open to non-residents.,[]
5/5,"This is an hotel located at Lekki express way, Sand filled close to the fourpoint hotel just by the lekki first toll gate it is a Kool place for tourist and also a good place for recreational activities",[]
5/5,"Oriental hotel is one of the best place to go in Nigeria either to showcase your product, your talent,weddings,and various ceremonies n even to have a nice time with your family",[]
5/5,"Oriental hotel stands tall among others, their services are exceptional and the event/function halls are top notch.",[]
5/5,"Awesome place. More like paradise in thr Centre of Excellence, Lagos.It is a must go to whenever you are in Lagos.",[]
5/5,Nice place with good customer service,[]
5/5,Oriental hotel is a fun place to be. I love everything about the arena,[]
5/5,Its quite calm and serene. Its beside the lagoon. And has superb chinese and Japanese restaurants. It also has a really cool confectionary bar,[]
3/5,It's a comfortable Environment with adequate facilities but smokers contaminates the free air,[]
4/5,This is a great place to have an event.It's Chinese Restaurant has mind blowing cuisines. The views are amazing.,[]
4/5,I had a great stay there. Great services,[]
5/5,"Adjacent to the Admiralty toll gate is the Oriental hotel. This is one the top most hotels in Lagos, it is a world class hotel location at the bank of the Lagoon which makes more unique. You need to be there and experience it for yourself.",[]
5/5,"Easy access from Ikoyi, VI & Lekki. Premium office spaces. Most importantly, high class Hotel, gift shops, chauffeur service, etc. Expanding infrastructure",[]
5/5,Really nice and conducive environment. They way I was treated by their staffs was wow.,[]
5/5,Coordination nop notch. The facility is very clean and staff are courteous,[]
4/5,The rooms are lovely but the hotel can be too rowdy at times owing to the fact that the other wing serves as an office,[]
5/5,Best service I've ever had in Lagos. We celebrated my Mom's 60th Birthday here and I was blown away.,[]
4/5,It's a very nice and conducive environment to lodge also to carry out occasional events😎💯,[]
5/5,"Great place to stay and rest, hold conference, event its home outside home, a visit will wow you",[]
5/5,Aesthetics and luxury on point.,[]
3/5,It's a good place to attend.,[]
5/5,Nice place.. Filled with a touch of cultural blend from different countries,[]
4/5,"I just so love this place.  Quick note. Coming from the main land, the last U turn is right in front of the toll gate.",[]
5/5,I made use one of the hall for an event. The lightening is great but can probably not sit up to 150 people comfortably,[]
4/5,"Oriental themed hotel and apartments with a very nice Chinese restaurant. Has a pool area, meeting rooms, cafe, coffee shop etc. Also has a commercial complex for office's and businesses.",[]
5/5,"The best place to be, to relax off the stress of Life.",[]
4/5,"It's an iconic hotel, where you will enjoy luxury at it's best. The water views are exotic",[]
4/5,I passed by but the environment looks good,[]
1/5,This place is going down the drain. Food in tue Chinese restaurant was dreadful. Toilets  are dirty (that tells a lot),[]
5/5,Beautiful place,[]
5/5,"Upbeat luxury in the heart of Victoria Island. This hotel boasts of top of the range amenities, lovely ambience, and great waterside view.",[]
5/5,"Courteous staffs, Good food, a place to relax and forget about everything. And the view from your room is awesome.",[]
5/5,State of the art facilities. Check!Hospitality. Check!Food (though expensive). Check!Parking lot. On point!Water view. Superb!,[]
5/5,"We conducted an event at it was fantastic, service, staffs and the facility is great - Restaurant with lake view is fantastic",[]
5/5,This place is beautiful,[]
5/5,The Lunch was great,[]
5/5,I think this is one of the biggest hotels I've been to in Lagos. Beauty and serenity extraordinaire.,[]
4/5,A place of a class mend for unique people,['https://lh5.googleusercontent.com/p/AF1QipNW9Q1q-lYVXxR9cBadaAd6uv4n-mjBq-Qy6oNG=w150-h150-k-no-p']
5/5,"Excellent place, lovely Architectural building, cool environment. However, outrightly expensive",[]
5/5,One of the best restaurants in Lagos. Care must be taken while navigating on Ozumba road in order not to miss it turn.,[]
4/5,"Great hotel, fantastic ambience. The Japanese restaurant on site is amazing with very Friendly staff. Fantastic location also",[]
5/5,Oriental Hotel is one of its kind.Serene atmosphere and well designed building.Customer service is great as well.,[]
2/5,"Good Location,big rooms with poor lighting,basic furniture,over priced...not good value for money",[]
5/5,"Attended the just concluded Art of Lagos tech event here. The hall was perfect, Great for like events.","['https://lh5.googleusercontent.com/p/AF1QipOZcSq3F3IRUc3VNQA06t6dpRFv9aDjVza_Ad16=w150-h150-k-no-p', 'https://lh5.googleusercontent.com/p/AF1QipOQNGpkZOP532JBIp7uNRd27Z293TOnjMww9U_5=w150-h150-k-no-p', 'https://lh5.googleusercontent.com/p/AF1QipNQ13sO1IMqYGAl6KTcHhm0sy1tLPaZzC05VkeD=w150-h150-k-no-p', 'https://lh5.googleusercontent.com/p/AF1QipN-KT770jRoR9mnhOJgL8GiAWWeB8Rl2z0rjYpH=w150-h150-k-no-p']"
5/5,Great service at the skyline restaurant. Will definitely visit again.,[]
4/5,"Nice hotel and event centreFriendly staffs and really classy and well finished hotelGood venue for weddings , events and meetings",[]
4/5,Oriental Hotel is a nice venue for events and lodging. It is a 4-Star hotel for luxury lodging. It has halls of various sizes for hosting events. It’s overview of the Lekki Epe Expressway is exhilarating. The level of customer service is above average. There are however parking problems whenever events are being held there.,"['https://lh5.googleusercontent.com/p/AF1QipPvCbhOf94ZxMenIvX-VWcQuge5QgpSOQXB1t0c=w150-h150-k-no-p', 'https://lh5.googleusercontent.com/p/AF1QipN4Q5y3UAQvdzGeLfxS1Su3VLwDv70Ak2Uh94L1=w150-h150-k-no-p', 'https://lh5.googleusercontent.com/p/AF1QipNwY6CKpWDo1L-TIZgLwhOyik9YJ-KEnWMhnZgT=w150-h150-k-no-p', 'https://lh5.googleusercontent.com/p/AF1QipM89mE9NRFI4ya2P4IyurDZzL0oQgDRebu7OcFO=w150-h150-k-no-p']"
2/5,I came for a conference and I was very disappointed with the facility. Poor management. I wasn't impressed at all,['https://lh5.googleusercontent.com/p/AF1QipNbTI9NPw6nI9G1lfvH4nqsA9t0lAmuWbUyGbGS=w150-h150-k-no-p']
5/5,"Oriental hotel is a nice place with fresh air from the see with troy bar and Tarzan flying boat around, a thirteen story building containing Huawei and etisalat office  etc",[]
5/5,Top Class Experience,"['https://lh5.googleusercontent.com/p/AF1QipPnmwObr56i6U3Sc8PStguKLUpfUb10J40aYt-C=w150-h150-k-no-p', 'https://lh5.googleusercontent.com/p/AF1QipM0f-Gfh20Fek-f8VQYTaFUsdjDQyjVIZFsZL7P=w150-h150-k-no-p', 'https://lh5.googleusercontent.com/p/AF1QipO1YxZuGOHzkqfku9aieHrtVARr5GEGiy_ZtdPG=w150-h150-k-no-p', 'https://lh5.googleusercontent.com/p/AF1QipMVDStRgzGlwsSp-OXINliYnG97lvijJvOkFKDo=w150-h150-k-no-p']"
5/5,"Cool place to relax, host events and more.",[]
5/5,Really lovely place. Was there for a wedding. The ball room is huge!,[]
1/5,It's a No for me....I was served spoilt food....It was quiet disappointing 😞,[]
5/5,"PAN Nigeria Ltd exhibited Peugeot 301, Higer bus and Ambulance at the 20th President Investiture Ceremony of CIPM at Oriental Hotel, Lekki.",[]
4/5,"Is a nice environment, cool and came vicinity for children and family, also include and office space too",[]
4/5,"The session is was,was beautiful. Calm environment ,security in place and other staff are great at their job.nice",[]
5/5,"Is a wonderful place, and good to Stay I really enjoy it, I can say it's the Best hotel",['https://lh5.googleusercontent.com/p/AF1QipMhQ-Nc_XMcPvjoOq2csCZLgBFTGx7LxwMx_-eT=w150-h150-k-no-p']
4/5,"Well, I attended a program there and cannot say much about the services rendered by the management. However, the location of the hotel is nice and spacious.",[]
5/5,It was splendid. It's a place to be at all times since it relaxes one's muzzles.,[]
5/5,They provide one of the best hotel services you can get in lagos..they also have the best customer service and is wheelchair user friendly,[]
5/5,"Hotel has got very lovely structure, customer service is top-notch. Highly recommended.",[]
5/5,Awesome customer service 👌Beautiful ambience,[]
5/5,"Believe me when I tell you that this place has got it's own weather, once you're in, you won't know what's going on at the outside world",[]
5/5,Lovely experience. Great view. Excellent service and nice ambience.,"['https://lh5.googleusercontent.com/p/AF1QipOGaIXY4mnM0Uhhsbsu5HBHOyk_1ibV9LHJOETX=w150-h150-k-no-p', 'https://lh5.googleusercontent.com/p/AF1QipMWBT52ATvffmzO94y3X5dJgCEczdjAO8qgtNSt=w150-h150-k-no-p', 'https://lh5.googleusercontent.com/p/AF1QipPv6VIuetKNQ0VFyuO2tNa76x60T4gJM56GqV-8=w150-h150-k-no-p', 'https://lh5.googleusercontent.com/p/AF1QipPTZGJY7fZxV_IYZExAI71pYhJuuQuljxxS4LX-=w150-h150-k-no-p']"
4/5,Top notch hotel. Luxurious and do have a good pool side for view of the lagoon.,[]
3/5,"Great Hot Pot, but Service needs improvement.  Menu could use some photos if you don’t know all the various items.",[]
5/5,Lovely.  Had live ban. And lounge,[]
4/5,"It's one of the best hotels in Lagos with great rooms and lovely structure, also has nice views","['https://lh5.googleusercontent.com/p/AF1QipOiAZZ7IGzSIKkf555AjZrRULdzcfAY5Wqvs7ES=w150-h150-k-no-p', 'https://lh5.googleusercontent.com/p/AF1QipPSN_o6lso07su-a6rMTebB_MZ_LZ-HC6KyDaBv=w150-h150-k-no-p']"
3/5,No safety briefing  by Lagos Oriental management prior to commencement of event.  This should be a basic thing to do for the safety of guests and very important in case of emergency.,[]
5/5,It's is an excellent neat and satisfying place,[]
5/5,Great ambience...great place for your conferences and events... A visit will most definitely convince you...,[]
4/5,"Oriental Hotel is very organized in terms of their parking arrangements. Overall, it is a great place.","['https://lh5.googleusercontent.com/p/AF1QipNCkpWPmqs3HBbZ6-88rj8R1rB19Lxm6g24mM8=w150-h150-k-no-p', 'https://lh5.googleusercontent.com/p/AF1QipPdYye-qUumbhNz8X9zRaAjHwh0-ienfew3VCU=w150-h150-k-no-p']"
5/5,It's a worthwhile place. It's a place with the experiences I have always enjoyed the bit of; such a serene environment.,[]
1/5,Please employ staff who are interested in serving customers with a ready answer and a smile. We pay to use your facilities.,[]
5/5,"It is super clean, the food tastes so good. Ambience is amazing",[]
4/5,"Great venue for a variety of events and the decor is a nice mix of modern, African and Chinese influences.",[]
5/5,This hotel is one of a kind with special views and luxury treatment. Experience here was awesome.,[]
4/5,"Very beautify place to be and hold world class event.  I use to think that Eko Hotel is the best in terms of Aesthetic design of the interior. Lagos Oriental Hotel is just 15 min (5.5 km) via Lekki - Epe Express Way from Eko Hotel's Victoria Island.Organising events of sorts with class, I recommend Lagos Oriental because it is a piece of unique event place. Bet that your red carpet show will never be the same.My team and I was shown round the facility during our Zafaa Global Awards pre-awards stage and every other places we have been became ordinary.Good Security/Nice staff structure, good ambiance,  hospitality at it's best.Comparable to Hotel around the world!",[]
4/5,"Serene & Urban, Generally Nice atmosphere! The Bar Lounge won't mind a re-upholster of Furniture..",[]
5/5,"Beautiful terace, profesional staff",[]
5/5,It's so beautiful especially the indoors and the back view,['https://lh5.googleusercontent.com/p/AF1QipPOZX0NsptZ9udKkvVOc6gHak_AOmp03ZEr-FdJ=w150-h150-k-no-p']
5/5,Great and nice place. Had our AGM here and the hall used was well suited for the meeting.,[]
5/5,Good place to be,[]
5/5,I really like it,[]
5/5,Awesome and safe.,[]
5/5,"Very lovely environment, classy and pricy but worth every dime","['https://lh5.googleusercontent.com/p/AF1QipP7ZxBeP6J88_L7sb62db-AFo5aQRaWoADKRvCj=w150-h150-k-no-p', 'https://lh5.googleusercontent.com/p/AF1QipN8mM30bKMXnTvAnqv7RFqpmOdAXcnmig2RwC90=w150-h150-k-no-p']"
5/5,The oriental hotel is good  & safe place.,[]
4/5,Lovely place but service level not so good,[]
5/5,"'How to Sell to Nigerians' was the Book Launch I went for and it was a privilege to be part of this competition on The Book Cover, though I didn't win. Thank you Oloye for giving the world this piece. Oriental was such a cool place!",['https://lh5.googleusercontent.com/p/AF1QipM-JYxkvKPZ0A9TABk_2Xd0groIxiBcSLJLcW91=w150-h150-k-no-p']
4/5,Ambience is great! Adequate parking space and halls for all kind of events.,[]
5/5,"Lovely, a better  place to enjoy fun",[]
4/5,"The hotel is not bad, the rooms are massive and the gym in the hotel Skyfit is lit",[]
5/5,Very accessible to most of my meeting venue in Lekki and VI . The treat is superb,[]
3/5,A  cool and loving place to be and hang out,[]
4/5,"Hospitality is excellence, cool ambiences, car rental services, fashion botique, continental and intercontinental dishes...... Spacious swimming pool.","['https://lh5.googleusercontent.com/p/AF1QipP35HvK0Gtq2W07gmJBqeeZP-EO4I1gLgKXeSnC=w150-h150-k-no-p', 'https://lh5.googleusercontent.com/p/AF1QipN0tB72-Rl_Xg4j1YvcpAiZn00gz8vkvsW5fR2C=w150-h150-k-no-p', 'https://lh5.googleusercontent.com/p/AF1QipMZ4iRFUBbZ1lZMpkSQBnFUHAlDa6huJfEvVIap=w150-h150-k-no-p', 'https://lh5.googleusercontent.com/p/AF1QipMmHIWV_tp4mmiqoVm2YDRfy0muqdaafJ19pzCR=w150-h150-k-no-p']"
4/5,Nice environment with great view of the express way and the lagoon behind. Good food and clean environment.,[]
5/5,Was here for a colleague's 50th surprise birthday party...beautiful ambience and coordination.Food was great also.,[]
4/5,"Nice place , good food.",[]
3/5,It's a classy place offering hospitality services for upper middle and high class clientele.,[]
3/5,You basically paying for the location. Rooms are massive though,[]
5/5,"Great place,pleasant ocean view. Good value for money",[]
4/5,A good place with great view of the Lagos lagoon. Good meals. Excellent event halls.,[]
4/5,It's beautiful and the staff there are pretty respectful. The African bar was a little noisy though.,['https://lh5.googleusercontent.com/p/AF1QipMQJ7JIOMT1eHdTEOu4lswGs2TzbsDS3EorXVE=w150-h150-k-no-p']
3/5,It's such a beautiful structure unfortunately the maintenance let It down,[]
5/5,I was at their event hall for a program and the architecture was interesting. The lighting was also awesome,['https://lh5.googleusercontent.com/p/AF1QipMDL1p2CNclQx_9HToOLaQ1jneM3THt_DO1dTn_=w150-h150-k-no-p']
4/5,"Great experience I had with a friend in the hotel. Ambient environment, Lagoon view, exquisite meal and highly recommended.","['https://lh5.googleusercontent.com/p/AF1QipPobJtc0H0VFtbyt4VC5ylULRI4hFbRYCXurnVS=w150-h150-k-no-p', 'https://lh5.googleusercontent.com/p/AF1QipNggiR3hJxUCukJ9-abpK5XclyZu438Z50r-OWJ=w150-h150-k-no-p', 'https://lh5.googleusercontent.com/p/AF1QipOdzIAt4Wzz_k3dTS4owniAP6djyn9u9C7potoy=w150-h150-k-no-p']"
5/5,Oriental Hotel is indeed 5 star 🌟I absolutely love the Water View,[]
2/5,The hotel has a cosmetic feel about it: looks nice on the outside but not so modern on the inside.,[]
5/5,Beautiful environment and excellent service,[]
4/5,is very good 👍,[]
5/5,I love it,[]
4/5,Nice place to relax good customer service smiling waitresses. Lovely rooms.,[]
5/5,"Great view. Lovely hotel. Not your regular hotel, pricey but worth it.",[]
5/5,Had an awesome moment there. Beautiful place with quality hospitality,[]
5/5,"Great space, parking and amazing view of from the rooms.",[]
3/5,Huge business hotel in main business district of Lagos. Great location for conferences. Has kind of worn feel to it.,[]
4/5,Oriental hotel is an excellent home away from home,"['https://lh5.googleusercontent.com/p/AF1QipMa1Lh_-f8xyS4qLzilfhx0aZVfF6faint-PwEc=w150-h150-k-no-p', 'https://lh5.googleusercontent.com/p/AF1QipOurh_oFbOPIzQCe7dREcT5QHboTFJk7wj4c-Yw=w150-h150-k-no-p', 'https://lh5.googleusercontent.com/p/AF1QipPhWxK7wbRzBPFnhpEixLbvCx5TVCuoC8KgHCGs=w150-h150-k-no-p', 'https://lh5.googleusercontent.com/p/AF1QipO53uiKJ4ufvMfazYtg2hJdFH6QQM_tWNLSbAcv=w150-h150-k-no-p']"
4/5,Great accommodation experience....,[]
4/5,It's a cool place to but with little challenge of enough parking space.,[]
3/5,"Its an imposing edifice. But lacks 'soul'. Nice hotel with chinese managing it, and looking like they are doing you a favour.",[]
4/5,"Nice hotel, has a great view of the river behind it. Clean rooms too and cool location.",[]
5/5,"A very good hotel to stay in while in Lagos. They have beautiful halls for special events like weddings, birthdays etc.",[]
5/5,A really nice place for events and relaxation.,[]
5/5,"Nice hotel. Great views. A secret dish on the menu ... ""chicken fried rice with pepper sauce""... You're welcome.",[]
5/5,The experience here; food-wise and sleep-wise have been one of my best and favorite. Definitely worth going to and staying over.,[]
5/5,"The hotel is awesome,Oh my God everything is wonderful, the rooms,their services,the viewa..Everything I mean",[]
5/5,wonderful Experience,"['https://lh5.googleusercontent.com/p/AF1QipMgULVKPWxl0XKtzSSGKDN6biZgKv6JQ0LStCbK=w150-h150-k-no-p', 'https://lh5.googleusercontent.com/p/AF1QipMcdse13NzqIkI3iPzAcVpOe2hXoHRqrfbbz-Hi=w150-h150-k-no-p', 'https://lh5.googleusercontent.com/p/AF1QipM8GUBfaQMytE7gZRpRUom27plJV3YBHr6_9xzy=w150-h150-k-no-p']"
4/5,"I attended an official function in the small ball room, the ambient is quite relaxing","['https://lh5.googleusercontent.com/p/AF1QipMETPfqzj7Xb2pzRv1vlm8G_WF_D8qO12wiRpA4=w150-h150-k-no-p', 'https://lh5.googleusercontent.com/p/AF1QipO6ee6o7xZ3tZXeT8Bcekd-eA9mNeRTP4KxC74j=w150-h150-k-no-p']"
5/5,"It was a lovely place to be, went there for my company's one year anniversary and car award gifting.",[]
5/5,Anytime you go there try the rooftop restaurant at night..it was an awesome experience..come back and thank me,[]
5/5,"With your money and class, oriental would serve you beyond expectations. The view there is just bad ass. Duff's hat",[]
5/5,"Its a great place to be, love its location, gives you a very good view of Lagos both the waterways and the roads",[]
5/5,"Fantastic environment.OPEN rooftop restaurant and bar, great place for conferences and business meetings by the waterside.",[]
3/5,Ambience was cool...but the food at the garden(Chinese) restaurant was not so cool...food was just OK..,[]
5/5,The view is amazing. You need to see for yourself,"['https://lh5.googleusercontent.com/p/AF1QipNAER2Dk_m_imyLTJYa0MmiqgfU2fd2ZaM-Azsg=w150-h150-k-no-p', 'https://lh5.googleusercontent.com/p/AF1QipNzeHXnGeY2sy_DGYj2rGRQkr47YqexSgiWvg6K=w150-h150-k-no-p']"
5/5,"Great place to be,  good ambience.  Nice Ocean View. Great service.  Nice large  rooms.",[]
4/5,Nice but the surroundings are scary,[]
5/5,Just exquisite,[]
4/5,"Great place for private events, with multiple hall options.",[]
5/5,I love everything about this hotel 🏨 I can't wait to go back,"['https://lh5.googleusercontent.com/p/AF1QipNqVPKUVBx6n9EU5TX_cBQAxT5lM8Q3tfDyIV7W=w150-h150-k-no-p', 'https://lh5.googleusercontent.com/p/AF1QipPTBTdmNRxCp8NxyivymLdDcOudTLINazS0LDxq=w150-h150-k-no-p']"
5/5,"Really lovely place,I visited the hot pot Chinese restaurant and had a tase of there tasty delicacies. You need to vist it.",[]
3/5,Lovely place but no much parking space for taxi/uber drivers,[]
4/5,It has water front and it's beautiful also accessible to all kind of person.,[]
5/5,"It was fun, even with all their staff they treat peoples with respect.",[]
4/5,It's upscale and chic. They pay attention to deatils. Lovely place,[]
5/5,Nice place. I had a beautiful experience here,[]
5/5,"Nice location, conducive environment,  beautiful view. Lovely rooms, standard halls. Oriental hotels.",[]
5/5,It's cool here and a save place to be with a tight security 😁,['https://lh5.googleusercontent.com/p/AF1QipOYVwjvWluAJlOqzFnU-3SRc9JVu56jsnGjblk=w150-h150-k-no-p']
5/5,"Wonderful experience for me at this place,lovely environment with good people,with world class services.",[]
5/5,Nice place. Waterside view. Serene environment. Posh restaurant.,[]
4/5,"It's a great hotel, love the ambience. Their ACs works pretty well too",[]
5/5,When u have a very stressful day and u want to relax trust me oriental hotel is a place to look towards for meeting and conference u can also trust them,[]
4/5,Classy and Cool. Nice location by the water  with a beautiful view. However may need to improve security.,"['https://lh5.googleusercontent.com/p/AF1QipNS57WGP0l0VB2R2Sjga4AZGQvFQpVBuDhph2yu=w150-h150-k-no-p', 'https://lh5.googleusercontent.com/p/AF1QipNYcUPd6jRcT9YrTrjxI12Wqc_tfMR8ikrTZD0v=w150-h150-k-no-p']"
4/5,It's a very nice and cosy place to be,[]
5/5,Great place. Excellent service,[]
3/5,It's a good hotel. Rooms aren't to my taste though. Too spartan. I prefer cosy,[]
4/5,See view from the roof top terrace is a treasure.,[]
5/5,Loved the experience,[]
5/5,"It's a you will like to visit, wonderful great experience and a lot more.",[]
5/5,"Good nice place for good comfort , their Africa bar is definitely a place to try out next time you visit.",[]
4/5,"Great staff, I love the wooden staircase 🥺",[]
5/5,Truly a 5 star hotel,[]
