rating,review,image_url
1/5,The last event I had the place is fun to be it clean,[]
5/5,Elegant place with fantastic view. Really upper class,[]
5/5,"I love the environment, the rooms are built for full comfort",[]
5/5,Very well located. The lagoon view is breathtaking.,[]
5/5,It's a cool place to be,[]
5/5,Great place...Serene environment.,[]
5/5,"This Hotel is awesome, buildings are perfectly structured and attractive,,",[]
4/5,Great Location for evening chill and lovely chinese food,[]
4/5,Nice waterside view and lovely wide rooms,[]
5/5,"Exquisite and Lovely place to be, it's home away from home.",[]
4/5,Cool atmosphere and exquisite place,[]
5/5,"Every thing here is perfect...... The Halls, The Swimming pool, The Services, The Etiquette. Every thing is PERFECT.",[]
4/5,Lovely place for lodging and party with good environ,[]
5/5,Lovely place and a very serene area,[]
5/5,"Great place, beautiful scenery and exciting ambience",[]
5/5,A very wonderful place to be... Premium luxury.,[]
4/5,Love the sea view and the street view option suite...,[]
5/5,Great place and spacious,[]
5/5,Stunningly beautiful. I went there for a wedding and had a lovely day.,[]
5/5,The food is expressive. And the room view is lovely.,[]
4/5,The ambience of the hotel is simply breathtaking. I love it,[]
5/5,I had a nice experience,[]
5/5,"Oh,this is an awesome place to visi,with nice serene and 5atar rating",[]
5/5,Lovely and very accommodating,[]
3/5,A combination of accommodation and business premises. A good spot of event hosting.,[]
3/5,Was at the Chinese Restaurant and Everything was perfect.,[]
3/5,"Goood location, facilities a little old....",[]
5/5,Just that the party hall is nice.,[]
5/5,Very niceWell okay securityEasy to identify,[]
5/5,"I went for an event actually but Oriental hotel sure doesn't need a review, its one of the best","['https://lh5.googleusercontent.com/p/AF1QipNsRgFKUCo_cir0xlpySSRT6EL1HtYeV-_wNSno=w150-h150-k-no-p', 'https://lh5.googleusercontent.com/p/AF1QipNA8j8qDo6WeXy6u9m2oQwc4spy1tNMKo8tTYEf=w150-h150-k-no-p', 'https://lh5.googleusercontent.com/p/AF1QipNZy_ECF1NMzmfvlV27jD0hh78CJj4-MBPQyti8=w150-h150-k-no-p']"
3/5,Beautiful space and food. Service is a bit sluggish.,[]
5/5,One of the best hotelI love the environment,['https://lh5.googleusercontent.com/p/AF1QipNCL3aINF9vTjWotCut8vCIh7jyuz-ny897LCAp=w150-h150-k-no-p']
5/5,"Lovely hotel, has some rentable area for shops and offices",[]
4/5,A five star hotel with state of the art facilities and top notch service,[]
4/5,Lovely and exquisitely furnished rooms,[]
4/5,"Oriental hotel on my streets in Lagos Lekki is all good nmd, n.m.d😎😎😎 on the street of Lagos and mg On The Street of Olathe shagu nmd on the street of Orient are nmd on the street yo yo🚕🚕🚖🚦🚥",[]
4/5,Superb,[]
5/5,So good and nice perfect view,[]
5/5,Awesome place. Took my breath away.,[]
5/5,Great ambience.. multiple restaurants for different tastes,[]
5/5,"Nice structure, exquisiteness, luxury. It's a masterpiece.",[]
4/5,"Always a nice ambience, worth your ever penny!!!",[]
5/5,Great view of the lagoon. Be observant as access routes may be a bit confusing,[]
3/5,"It was fun. Parking is becoming a problem though, especially on busy days.",[]
4/5,Great place,[]
5/5,Badagry is historical...telling and showing all about the slave trade and early missionaries that defined Nigeria of today,[]
5/5,"The hotel was very nice and very secured, the staff were good",[]
5/5,Definitely a five star hotel. Exquite interior designs and very warm reception.,"['https://lh5.googleusercontent.com/p/AF1QipO-iwbP2Wow6tNtcsXrMN1UjqJ1gJNpAHSH8Ta-=w150-h150-k-no-p', 'https://lh5.googleusercontent.com/p/AF1QipOhq6osKjlkua1-Y8x-FNByAfqkbvWmX4zy0PMo=w150-h150-k-no-p']"
5/5,Aesthetically pleasing environment and a very helpful staff,[]
4/5,Nice serene environment but fairly antiquated.,[]
5/5,"The hotel for the wealthy, the Elites and the rich at heart.","['https://lh5.googleusercontent.com/p/AF1QipPtLi90dNax84630GNN8u2P-RfV7JNH9rarEuFQ=w150-h150-k-no-p', 'https://lh5.googleusercontent.com/p/AF1QipN6cfy6XqJJKxhwIHYatStS-YdL3RWPAS36AiES=w150-h150-k-no-p']"
4/5,Enjoyed my stay.,[]
5/5,Excellent,[]
5/5,Have the best all you can eat Sunday brunch,[]
4/5,"Nice rooms, great meeting rooms but pricey.",[]
5/5,Truly a five star hotel.,[]
4/5,If not for the money spent I'd have said it should be taken to another location.,[]
5/5,One of the best places to be on the Island. I love everything about it.,[]
5/5,Beautiful rooms and top notch service,[]
4/5,Cool place great ambience and good service,[]
4/5,Good looking environment and an awesome atmosphere.,"['https://lh5.googleusercontent.com/p/AF1QipO_wgeVMFy0Yd6uOr6lzkBMMwml9HdHdPSp4ZOI=w150-h150-k-no-p', 'https://lh5.googleusercontent.com/p/AF1QipOMfrWh7W7JXQp29K5zA2NDB_oVFt6EE7yTvC42=w150-h150-k-no-p']"
5/5,They render unique services. Serene environment 👍,[]
5/5,"Always a good time at The Oriental. Great hotel, great staff, great value for money...",[]
5/5,Beautiful grand ball room with decent facilities.,[]
5/5,Beautiful serene!!! Good hospitality management.,[]
5/5,Radisson blue ikeja is far better than his overpriced place. Yeesh,[]
4/5,"The food is perfect, and I love the customer service.",[]
5/5,"Great services, bar, restaurant, lounge, conference room",['https://lh5.googleusercontent.com/p/AF1QipPb88WzvjXK6rZY1SkuSnQ6BS5YU7kVEKTQsehz=w150-h150-k-no-p']
4/5,Very cosy and nice place....,[]
5/5,"Was there for the Tech Crunch Lagos conference, had a great time.",[]
4/5,You're always welcome to visit anytime,[]
5/5,"Luxury 5 star hotel, my experience is just super divine.i love",[]
5/5,Lovely Place for Event and Relaxation,"['https://lh5.googleusercontent.com/p/AF1QipP5bkP-6bYmy0so_-QX6N1OoHtOlGxF5XK-O--H=w150-h150-k-no-p', 'https://lh5.googleusercontent.com/p/AF1QipOETky9DBHsHo_3KTZHfdvc8EDiltEaWWFyRROi=w150-h150-k-no-p']"
5/5,Amazing,[]
5/5,Talk about excellence. A 5 star.,[]
4/5,"A great place for conferences, meetings, accommodation and relaxation.",[]
5/5,😊,[]
5/5,Always top class,[]
5/5,Classic and one of the best place for lodge and other activities,[]
5/5,High class hotel for events and relaxation. Very popular around Lagos,[]
5/5,Its a very nice place to be for international visits and local,[]
5/5,Very good for relaxation. It also houses some businesses.,[]
4/5,Great structure & facilities with excellent views,[]
5/5,Oriental hotel provides you with the Oriental experience. The view is incredibly beautiful,[]
5/5,Fantastic place,[]
5/5,Amazing but dull after the endsars period,[]
5/5,Perfect,[]
4/5,"Great chicken fried rice, best in Lagos & and not designer expensive",[]
4/5,The facilities are showing signs of wear and tear. The parking could be cleaner than it is.,[]
3/5,It's huge and spacious but kinda old.,"['https://lh5.googleusercontent.com/p/AF1QipO1oxY30h8l9DmGxS9j_gmCkzkaW6IIdvNJSKIJ=w150-h150-k-no-p', 'https://lh5.googleusercontent.com/p/AF1QipMQ9jrnkousxDYtlNKRBjfHVklynsAAWZZ_5qBt=w150-h150-k-no-p']"
4/5,"Very spacious, strategically located, cool environment",[]
4/5,Cozy environment,[]
5/5,Hospitality at its best..  Awesome reception and facilities... 😍,[]
4/5,A good and very hospitable place,[]
3/5,It's a very big hotel along lagos epe expressway before lekki tollgate,[]
5/5,Oriental has a good view of Victoria Island Lagos...the Lagos lagoon is just behind the Hotel.,[]
5/5,Thinking that construction is still ongoing makes it more delightful. Expect more,[]
5/5,"Nice place, for events.",[]
5/5,Absolutely fantastic hotel in a safe and secure location in Victoria Island.,[]
4/5,"Good hotel for vacation, exhibitions, but too many traffics.",[]
4/5,Both Chinese and Japanese Restaurants on the 3rd Floor are great places to eat,[]
5/5,The gym there is very good and affordable,[]
5/5,I went to Oriki Spa. The deep tissue massage was heavenly,[]
4/5,Oriental Hotel is a luxury hotel situated at Lekki Express Road and Victoria Island area of Lagos. Oriental Hotel is within proximity of numerous business and tourist attractions.,[]
5/5,The kind cold around 9pm ain't normal,[]
4/5,It's a classic place to stay if you've got the money.,[]
5/5,Organized hotel and we'll trained personnel,[]
4/5,Nice view and space plus free drinks in the fridge.,[]
4/5,The place make sense,[]
5/5,If you like Chinese food you should check this place out.,[]
5/5,Great hotel but cheaper options available in Lagos,[]
4/5,Well situated. Great sites awaits all.,[]
5/5,Cool n serene environment. Love it,[]
5/5,I been here once for photo shoot. Nice place,[]
5/5,It is a really nice place and very secure,[]
4/5,"Lovely place to be, I enjoyed my stay",[]
4/5,I work on the 6th/7th floor. There you have 9mobile and Hussein’s staff.,[]
5/5,"A place of stylishness, hospitality and fun. Home for all class",[]
5/5,Its a good for someone to av his leisure time,[]
5/5,Excellent Location for Corporate Events,[]
5/5,Food is awesome. It's not as outrageously expensive as you think.,"['https://lh5.googleusercontent.com/p/AF1QipOrGdXwiTuyV_2cWaPUp5Y6g8wFFB9G3zBxkAg4=w150-h150-k-no-p', 'https://lh5.googleusercontent.com/p/AF1QipM9XP7Ruv23ck19d1j8yn0Fha-qZ1OuV_4Bte66=w150-h150-k-no-p']"
3/5,"Spacious room, great ambience and beautiful service",[]
5/5,I went for a meeting in  one of their halls.. Good service,[]
5/5,Nice place with the great hospitality services.,[]
5/5,Lovely place for business and personal activities.,[]
5/5,One of the best hotel on the island with a nice view,[]
4/5,Very lovely hotel and good for events,['https://lh5.googleusercontent.com/p/AF1QipM_6HbaXiGi3pEr9_vbO8rLPhAJ3niptvbiEh2e=w150-h150-k-no-p']
3/5,"Sea view, aesthetic accommodation and exquisite rooms. Nice sea ambience",[]
5/5,"An hotel with class, from the beautiful well crafted structure to the classic interior design.",[]
5/5,Great place to chill for the weekend. Great for weary travellers,[]
5/5,Nice hotel...quite pricey too,[]
3/5,"Classy and high end, good place for date night",[]
5/5,"Exquisite hotel for the high class, touch of class and quality",[]
5/5,"Fantastic place, well built and imposing structure.",[]
3/5,It is well organized and so beautiful,[]
5/5,For local and international. Accessible and clean. Although expensive,[]
5/5,Best in all great friendly staffs made here the best,[]
5/5,"No doubt about this fact, it's a 5 star hotel. An international grade.",[]
4/5,All good except for the bad Internet connection,[]
5/5,One of the greatest places I've visited!,[]
4/5,Staff were polite and they were very helpful too,[]
5/5,Such an inviting ambience,[]
5/5,Superb ambiance and equally good customer care,[]
5/5,I love it,[]
3/5,Good facilities and warming gestures of staffs at the hotel,[]
5/5,Very amazing place with awesome views.,[]
5/5,Beautiful evening at the Osibodu nd Tubi's wedding at Lagos Oriental Hotel,[]
5/5,Fantastic Hotel Service.. One of the best in Nigeria surely,[]
4/5,"Good facility. Chinease restaurant is not very good, but has a good price",[]
4/5,"Lovely environment, beautiful sceneray and warm hospitality",[]
4/5,It's always a nice idea   its clean and they ve an event center as well,[]
4/5,"I like orientals... beautiful terrace,fine halls and friendly workers.",[]
5/5,100% Great place to be.. Seaside view,[]
4/5,A great hotel experience.,[]
4/5,Not my first time but it's a place you'll always wanna go,[]
5/5,This is a choice location for events!,['https://lh5.googleusercontent.com/p/AF1QipMvdDlhOLh_U5uolHASa3rfz4gimxm-nRCnTbfJ=w150-h150-k-no-p']
4/5,Toilet on the 11th floor but other than that beautiful scenery,[]
5/5,The promise land,[]
5/5,Lovely hotel! Very good ambiance,[]
4/5,My experience at Oriental Hotel limited to Reception only. Cool.,[]
5/5,SkyFit gym is excellent and top notch view,[]
3/5,Relatively calm with series of occasions,[]
5/5,The hotel is so beautiful. Great service,[]
4/5,Great views and the restaurant is really nice,[]
4/5,"lovely, exciting and beautiful, well secured.. real cool",[]
4/5,Great place for events such as conferences and the likes.,[]
4/5,Beautiful place to be. The ambience is superb.,[]
4/5,Nice hotel overlooking the lagoon with good facilities,[]
5/5,Wonderful ambience,[]
5/5,Well maintained and managed. With rental spaces for office use,[]
4/5,It was delightful and very welcoming.,[]
5/5,Good,[]
5/5,It should be the best hotel in the city so far,[]
4/5,One of the best and most comfortable hotels around Lagos.,[]
4/5,"Good hotel to stay, but not good food option for Indian vegetarian",[]
5/5,Beautiful ambience. Coolest of the lots around.,[]
4/5,There services are nice but there is always room for improvement,[]
4/5,Single lane road in and out is a nightmare in lagos traffic but inside is beautiful.,[]
3/5,Very good upscale hotel in lekki for lodging and events,[]
5/5,Spacious and comfortable therefore I am good with the establishment,[]
5/5,A masterpiece of Chinese/Japanese life style by Nigerian. Its classy,[]
5/5,You most not just be rich but wealthy to enjoy this place to the fullest,[]
5/5,Great place to be. Nice reception,[]
5/5,"Lots of parking space, good coordination and serene environment with a good view",[]
5/5,My guests loved it. Would recommend,[]
4/5,"Place by the sea side in Victoria island,by oniru busstop close to toll gate",[]
5/5,A good sight to behold.,[]
5/5,The restaurant here is fantastic!!! Excellent service,[]
5/5,"5 star ✨ hotel in V/I, Lagos",[]
4/5,The event was properly organised. The lightning was a little faulty.,"['https://lh5.googleusercontent.com/p/AF1QipNpVkgL5Aec54ajbr-wd79v-Fsr0qmRdCAFK2xG=w150-h150-k-no-p', 'https://lh5.googleusercontent.com/p/AF1QipP7zs4tYxx3q6DhP6JwrdSowuCof5_B9UDVhP0N=w150-h150-k-no-p', 'https://lh5.googleusercontent.com/p/AF1QipMEiCZ_qTfygYg3GFJ6U_drDJDNd2VxVRZDZhYQ=w150-h150-k-no-p']"
4/5,"Its calm and collected, filled with friendly people",[]
5/5,Its a nice place for conference and other personal stuff,[]
5/5,"Great ambience, clean and luxurious.",[]
4/5,"Apart from it's aesthetical view, proximity to access roads is guaranteed.",[]
5/5,Beautiful lagoon front hotel. Always busy.,[]
5/5,"A nice place to be, a good meal in a serene environment",[]
5/5,Amazing hospitality service with great architecture,[]
3/5,You may need to specifically ask for what you want here. Special rooms are not offered on the first request,"['https://lh5.googleusercontent.com/p/AF1QipPtqLu8kGCqX4mACP3iRTmThOAcuQ_vfhLo6sLn=w150-h150-k-no-p', 'https://lh5.googleusercontent.com/p/AF1QipPTlNpMMa0bk9o-cECuv8ps88BVPq7qXhlT-pR1=w150-h150-k-no-p']"
5/5,Great place. Nice ambience,[]
4/5,A good environment to Lodge in with a beautiful view,[]
5/5,Cozy place. Costly. Not for low and average income earners. Highbrew hotel,[]
5/5,Really love this place... Nice place to be and fun,[]
4/5,Nice place. Very well put togethrr,[]
5/5,The Chinese restaurant is awesome. Food tastes great,[]
4/5,Lodge at a convenient place,"['https://lh5.googleusercontent.com/p/AF1QipOhjmElRYmgLPpHxPQs_lI64asAAjq6NUC35xc2=w150-h150-k-no-p', 'https://lh5.googleusercontent.com/p/AF1QipM3Q9PA68bjEpg-zoBW7qFGUBl1I5dCFAtSHQ-g=w150-h150-k-no-p']"
4/5,Lovely place to visit for leisure and relaxation.,[]
5/5,Lovely and a very nice place to relax,"['https://lh5.googleusercontent.com/p/AF1QipNY7mb6RlyxHpbv1k_sq99jBqMXU8EWYbZq9piA=w150-h150-k-no-p', 'https://lh5.googleusercontent.com/p/AF1QipMN9Q-SN7kieFC039qh0YBFsV3Pb-daStcnsnC9=w150-h150-k-no-p']"
5/5,"Lovely hotel, wonderful view over the lagoon",[]
5/5,"Was great, Serene environment and lovely staff",[]
4/5,Nice but pricey place,[]
4/5,It got nice ocean view 😊,[]
5/5,One of the best hotels in Lagos. Well maintained facilities.,[]
5/5,"Great place, lovely view of the water.","['https://lh5.googleusercontent.com/p/AF1QipPDaaaE6tX2LmgmgIjtDKsRiZhCdFkxsFzXI6jw=w150-h150-k-no-p', 'https://lh5.googleusercontent.com/p/AF1QipPdDkYCTlWaO19eGJVS184KRxJHJEamY0_pW4OD=w150-h150-k-no-p']"
5/5,Excellent,[]
5/5,It's a Classy hotel with nice cuisine,[]
4/5,"Very spacious and comfortable room, with adequate amenities.",[]
5/5,A quiet and classy place to have an event,[]
4/5,"Great place for hospitality and events, especially conferences",[]
5/5,Amazing,[]
3/5,Nice place but breakfastlet it down,[]
5/5,Nice serene place for accommodation and events.,[]
4/5,"Cool environment, a little high ended for regular lagosians",[]
4/5,Good number of halls for events & adequate rooms to support,[]
4/5,"One beautiful hotel in Lagos, customer service quality is on point",[]
4/5,Top notch event experience,[]
5/5,Nice hotel hotel with beautiful environment and event halls.,[]
4/5,Hot Pot is unbelievable..you should not miss it..,[]
4/5,Great facility for lodging and banquet needs,[]
4/5,Stay here in August. Very conveniently located and very comfortable.,[]
3/5,Not too bad... Went for a job site survey,[]
5/5,"This place is awesome, do spend sometime here and be surprised",[]
4/5,Strategically located in the high brow of Victoria Island.This is a modern hotel,[]
4/5,A well organized place and good for relaxation,[]
5/5,Nice hotel though a bit pricey,[]
5/5,Great place for the rich elites in the society,[]
5/5,Top class hotel. Expensive but worth the price,[]
5/5,Awesome. Had Chinese dinner. Very sumptuous,[]
5/5,A lovely place to be....,[]
5/5,A good place to be if you have the money,[]
5/5,"It has packing space ,well secured ,continental dishes ,conference hall and lot more.",[]
5/5,Harmony Publishing went for an event. Good environment,[]
1/5,Cool and serene  environment,[]
5/5,Great hotel. One of the top notch hotels in Lagos actually,[]
5/5,Nice,[]
4/5,A nice hotel with good water views.,[]
5/5,"Beautiful place, nice ambience.  A place to be!",[]
5/5,Amazing breakfast buffet options and scenic views.,[]
5/5,Perfectly place to hold your event,[]
4/5,Nice Chinese and Japanese food. Good sea view,[]
4/5,Lagos money working,[]
5/5,Very cool area,[]
4/5,Nice ambience...,[]
3/5,Very nice place to hold events,[]
5/5,Lovely experience.. nice place to be,[]
5/5,"Classy, elegant, great food, lovely ambience.",[]
3/5,"Comfortable rooms, nice views...food is ok...",[]
5/5,This hotel has all in one. It is very lovely and your comfort is guaranteed.,[]
4/5,Hotel for those who love luxury and comfort.. Very good place.,[]
5/5,"Great Chinese food, variety of restaurants and aesthetically appealing",[]
5/5,"A nice place to be, meet great people.","['https://lh5.googleusercontent.com/p/AF1QipMdBKaRIz5CmuVx-_eqocHTAsAmOJStwQwbfmtD=w150-h150-k-no-p', 'https://lh5.googleusercontent.com/p/AF1QipNAI5agm03d5d1qPjnRm7uH9DicroYhbB5_6T-w=w150-h150-k-no-p', 'https://lh5.googleusercontent.com/p/AF1QipPZJ_WRfmZjBNCV-BwTfInp7trCB984LHE3QaPJ=w150-h150-k-no-p']"
5/5,"One of the best hotels to be in, with very professional staff","['https://lh5.googleusercontent.com/p/AF1QipMA4q0NW6fI-rYNO1yaDBKxG_uUA96vadZIiZFr=w150-h150-k-no-p', 'https://lh5.googleusercontent.com/p/AF1QipNF8aWGxB1Kaxr4-bzVU9p6A7rvuhx4WRs7Hlr1=w150-h150-k-no-p']"
5/5,Best service ever.. I recommend this hotel. .,"['https://lh5.googleusercontent.com/p/AF1QipM5oCSJmJ61wRaVeOkjgq-oQK1sDDTcePklszLC=w150-h150-k-no-p', 'https://lh5.googleusercontent.com/p/AF1QipOnznl-yeo-l7sPT5LLMxrSY_t8beOQLu70-qwv=w150-h150-k-no-p', 'https://lh5.googleusercontent.com/p/AF1QipOfX0PrUMNVz6XgAlVmMiLRHpuZ1wiL47f9CdTY=w150-h150-k-no-p']"
5/5,It was a nice place to be. Skyfit gym precisely.,[]
5/5,Clean and nice staff. Keep it up,[]
4/5,It was very nice with good Chinese food,[]
5/5,Pure luxury...loved my stay there,[]
5/5,Had a great and memorable time here,[]
4/5,Cool environment. I even bumped into Timi Dakola😁,[]
5/5,Lovely place for hotel and good food,[]
4/5,Nice but be ready to eat Chinese foods,[]
5/5,Their chinese restaurant is one of the best in Nigeria. Very posh hotel,[]
4/5,"An outstanding place for hosting events, albeit expensive.",[]
5/5,Great Ambience and excellent aesthetic designs,[]
5/5,beautiful place. lovely food,[]
5/5,Beautiful Ballrooms. Ideal for high class events,[]
3/5,D environment was so neat ND Dere service is ok,['https://lh5.googleusercontent.com/p/AF1QipMQef0EtAz8xJePN-hAiRnXufltywXBuy1JpFyD=w150-h150-k-no-p']
4/5,"Located in the heart of Lagos, Victoria island, it is easilyAccessible","['https://lh5.googleusercontent.com/p/AF1QipOOBvJQSl6O_GaL9hxhgGtvbUv2MCGu4tSPmrw9=w150-h150-k-no-p', 'https://lh5.googleusercontent.com/p/AF1QipMojgOw71_Jz4oiJlHz5fXhnEg8bPE427_Tqa5h=w150-h150-k-no-p']"
5/5,Very nice environment nice building in fact is the best,[]
3/5,This a place I will like to visit again,[]
4/5,Great ambience. Limited parking spaces.,[]
4/5,Great place to stay and hold events.,[]
4/5,The standard is unmatched. Classy,[]
4/5,Has a compelling waterfront view. Quite nice.,[]
4/5,It's old but still ok. Quality services,[]
5/5,Its so exquisite I give it a 100%,[]
5/5,"Neat, spacious and very relaxing atmosphere.",['https://lh5.googleusercontent.com/p/AF1QipN0jJbw7DamWWhFyV-LUsm_5RYSmo8uLH-KjPJk=w150-h150-k-no-p']
5/5,Well organised place. Qualified for a 5 star.,[]
4/5,Nicelooking  hotel with a lagoon front bar,[]
4/5,Lovely Asian Hotel with courteous staff and nice facilities.,[]
5/5,Good Ambience and Great Customer Service,[]
5/5,Its a wonderful experience. Nice food.,[]
4/5,Very nice atmosphere,[]
5/5,This place serves your experience no doubt 👍🏻,[]
5/5,"An hotel with class, site's strategically in a very secured environment.",[]
4/5,Its was a cool filled environment. Lots to see,[]
5/5,"High standard, well equipped, nice sea view.",[]
4/5,Lovely hotel. I think the rug on the corridor need to be changed though.,[]
5/5,"Very superb, interesting, fun n a place to be",[]
5/5,A fantastic place to have a nice time,[]
4/5,Cool place but parking space issue,[]
5/5,I like the Oriental - always love to soak in the sights of the water nearby.,[]
4/5,"Beautiful experience, great for your events.",[]
4/5,Located between a Creek and a major toll gate. Has facility to host large meetings.,[]
5/5,Beautiful place to relax and enjoy life,[]
4/5,Good hotel for variety. Excellent gym facility,[]
4/5,"Very comfortable, just parking space issue",[]
4/5,The Conference held here was indeed aplomb.,[]
5/5,Beautiful hotel I would love all to visit,[]
5/5,Its a class on its own with excellent service and customer care,[]
3/5,"The view is very good from the 8th floor, breathtaking!",[]
5/5,A great place to be for luxurious life style...,[]
3/5,Very fine place to hold your meetings with clients,[]
5/5,"Great hotel. Matches international standards but as expected, very expensive.",[]
4/5,"Good service, friendly staff, excellent facility",[]
1/5,Good,[]
5/5,The rooms are fantastic also inlove with the pool side,[]
5/5,Service was Great had a good time,[]
5/5,Five star general live up they so don't go they,[]
5/5,Beautiful hotel in a great location and on a water front...,[]
5/5,It was really wow when you get there you don't want to leave 😂,[]
5/5,"Wafts of sea breeze keeps the atmosphere cool, always.",[]
4/5,A 4 star hotel with good quality service.,[]
4/5,"Very cool environment, relaxing and cozy",[]
5/5,Beautiful place to be with your loved once,['https://lh5.googleusercontent.com/p/AF1QipNzmjdm5bX_d3Y0knRTs2Ur8uLCunsFRPrCs_8F=w150-h150-k-no-p']
4/5,"Beautiful intererior, nice delicacies, cool pool side",[]
4/5,Good restaurants and the hotel is vert clean and good for price,[]
5/5,"Good parking space, wonderful customer service",[]
5/5,Oriental hotel that has company offices there. It's not a small place.,[]
5/5,Excellent ambience.... Fantastic ocean view,[]
5/5,Very lovely hotel. Best services,[]
5/5,Loved it. A top class hotel,[]
5/5,"Beautiful, ambience and cool environment that is supported by the lagoon",[]
5/5,"A hotel with world class facilities and waterfront ambience, nestled in the heart of Lagos",[]
5/5,"Attended an event at the terrace, beautiful view overlooking the lagoon",['https://lh5.googleusercontent.com/p/AF1QipNOgaiMfFt3HsDkLkBTRxctjWJ60YbKy9TPWb2L=w150-h150-k-no-p']
4/5,Well organised. Neat and a lovely ambience.,[]
4/5,"Huge property, large rooms, good service.",[]
5/5,It's a nice 5 star hotel,[]
5/5,Very cool place to relax,[]
5/5,Very nice place always to visits,[]
4/5,Easy to access. Decent accommodation and great service,[]
5/5,"Oriental Hotel is simply a five star hotel, it is more than expected. Everything works. ..",[]
5/5,Excellent building.Nice facilities,[]
5/5,"Top class hotel,,,decent environment","['https://lh5.googleusercontent.com/p/AF1QipO-kXKSVWdWwlCJMtCjAgE_t1S_qWFFT9WqE4zY=w150-h150-k-no-p', 'https://lh5.googleusercontent.com/p/AF1QipNky1062eXVE3YwmN4oLuBLfBORZJe03eGg9sAw=w150-h150-k-no-p']"
5/5,Good,[]
5/5,Lovely ambience always,[]
4/5,Didn't get an opportunity to get a picture on my first visit... Didn't miss it today though,[]
4/5,"Nice hotel by the Lagos lagoon, which giving you great scenery.",[]
5/5,Its a vsry great hotel,[]
4/5,Nice environment. Good security,[]
5/5,"You should consider patronizing them,  I had very nice experience",[]
4/5,"Excellent service, superb view",['https://lh5.googleusercontent.com/p/AF1QipO6fawIvX80iPcpGvhxZU3HLjXZRq89WZ7iq5sa=w150-h150-k-no-p']
4/5,Restaurant  is far from accommodation  area. Not too good.,[]
5/5,Where life's good when you can afford all they have.,[]
5/5,Good ambience for coffee and a quick bite,[]
5/5,Really dope,[]
3/5,"It was wow, spacious hall and very comfortable.","['https://lh5.googleusercontent.com/p/AF1QipMlCn1NeBhsCneO7dUOACfab-9EzPCF0VSKwBcS=w150-h150-k-no-p', 'https://lh5.googleusercontent.com/p/AF1QipMUYqsD_USfnDBiAJg6pEKWOCNWzueCBOnh0QHQ=w150-h150-k-no-p']"
4/5,Good hotel with a very accessible car park.,[]
