rating,review,image_url
5/5,Lagos Oriental Hotel is a sanctuary! I love the lounge area close to the reception. Aside from their warm hospitality the play some cool music that calms the soul... General the ambiance is always new and delightful to behold because I feel alive every single time.,[]
5/5,"This has been one of the best Hotels so far in Lagos in term of it's structure,designs, classical convenience, decorations, this Hotel is actually OMG visiting this Hotel was an amazing experience and it's really deserves nothing less than a 5-Star, you catlnt afford to miss it's exciting offers during events like Valentine's day, Christmas Eve and Day, Weddings and other Grand Occasions Wow I mean wow If there's a place of convenience I'll say you gotta Book Up a Room at ""Oriental"" and I bet you're gonna feel The difference cause it's clear................","['https://lh5.googleusercontent.com/p/AF1QipNLLAxLG8zuFc_dxvbUFiCl_U4sCOm5Z2s4zcWU=w150-h150-k-no-p', 'https://lh5.googleusercontent.com/p/AF1QipNQ72NknWlyi_Ix0KN5DbdWoUsTWANI4_H1aX7I=w150-h150-k-no-p', 'https://lh5.googleusercontent.com/p/AF1QipNf-HBJjSe_y5sYrqZWQuvREviYgOH50qPYcTrf=w150-h150-k-no-p', 'https://lh5.googleusercontent.com/p/AF1QipMYR8sW1uoa0se5i2J-M5DyPX2DgYOb4Z5_ioUt=w150-h150-k-no-p']"
5/5,Nice place .. I actually come here everyday to carry out my usual business activities .my office is on the second wing. I would be able to say about their rooms but I can say about the food and events hall which are top notch. They have adequate car park inside and outside. It’s central on the island just off Ozumba Mbadiwe express way. Just before the toll gate. There is also a gym and Spa in the hotel premises. Perfect innit? 😀,"['https://lh5.googleusercontent.com/p/AF1QipPTlnnUP4aP2faiheJFnd36PCznC_MjnkFyQe4V=w150-h150-k-no-p', 'https://lh5.googleusercontent.com/p/AF1QipPuVvoxPPqWXa4lkLz_SqAE8lxt9LFfe8KGRKz4=w150-h150-k-no-p', 'https://lh5.googleusercontent.com/p/AF1QipMjJgY3H38p4hTnq__QkXuOh3_r3ugJFVnzQzRx=w150-h150-k-no-p', 'https://lh5.googleusercontent.com/p/AF1QipNbONhF5dNHkkq5TEFvAmzjkSFi_RYOkllhG3YT=w150-h150-k-no-p']"
5/5,Historical set up with very lovely pool side view and the hall walk with artistic paints awesome,"['https://lh5.googleusercontent.com/p/AF1QipMJBalbm5vJ5goK58FSy5AfLSc5ylXDECl-lVw6=w150-h150-k-no-p', 'https://lh5.googleusercontent.com/p/AF1QipPBJWufcbuRIUAY1FJyjzr6RVXQXe967AqzEfYN=w150-h150-k-no-p']"
5/5,"The BEST place to be. Relaxation, events and good food. Good location. Excellent security services. Ample parking space. I wish I could give a 10star rating.",[]
5/5,I always find good places to eat and relax in the hotel.,[]
5/5,Right at the edge of the island. Great hotel for a weekend getaway. Good view of the  busy toll gate to the island and more especially of the water from the ocean.Concierge services. Great rooms and food. Continental and international cuisine.A bit expensive for an average person. But great services overall,[]
5/5,"Its 5 star rated hotel in Victoria Island of Lagos Urban City Metropolitan area..The hotel has different Intercontinetal dishes and a good ans seren environment for the foreigners.. would I say .. it was built solely for foreigners , top executive and presidential event host",[]
5/5,Fantastic hotel both in luxury and service.  An upscale place with exorbitant rates.  The rooms are designed for kings and queens.  There are several restaurants for  international communities.  The decor is simply exquisite. The security is top notch and the vehicle  parking organised.,[]
5/5,"When entering the Lagos Oriental Hotel, you feel an atmosphere inspired by a dynamic modernity.All facilities, from the Chinese Restaurant, the Japanese Gourmet Restaurant, the Lobby Lounge & Bar’s and the Grand Ballroom to the guest rooms and suites, meet the most exacting demands for comfort and service. Hospitality in the best Lagos Oriental Hotel tradition has been reborn.Lagos Oriental Hotel promises excellent accommodation, business and leisure experiences with 64 guestrooms including 9 spacious suites.With enchanting views of the lagoon each one of our guestrooms offers guests a unique combination of luxury and style and ranging in size from 60 to 300 square meters.Where modern style meets unquestionable comfort, Lagos Oriental Hotel’s guestrooms feature original artwork complimenting the Asian furnishings. The muted colour schemes contrast with a backdrop of city lights and skyscrapers. All the rooms have LCD flat screen televisions, wired or wireless internet access, individual air conditioning control, In room safe, complimentary tea and coffee making facilities, luxurious bathrobes and slippers.",['https://lh5.googleusercontent.com/p/AF1QipPWCAewxS84nLHSlxaSXqrLqn3e-TYQN9TtdChV=w150-h150-k-no-p']
5/5,Serene with all facilities in place,[]
5/5,"I'll rate Lagos Oriental hotel as a 5 star hotel. Though I didn't get to lodge, I was privileged to go around the hotel and it was great.",[]
5/5,"Oriental Hotel, as we all know and can see, has a massive edifice visible from Queens Drive behind it, and end of Ozumba Road leading to the toll gate.I’ll speak more of the halls where you can pay a certain amount for some hours, depending on the type and size of hall you are booking. It’s good to know that part of what you pay for is the buffet which comes as a compliment.Simple room with awesome staff.",[]
5/5,The sheer opulence and ambience. Strategically located to capture the view of traffic and corporate buildings in front and the aqautic splendour at the rear. Good catering and great service also.,[]
5/5,A 5 star for Oriental Hotel! Excellent customer service,['https://lh5.googleusercontent.com/p/AF1QipPwDHpdiDDxss6Qw3FmXBBihfC2cC6bMRdN7b6r=w150-h150-k-no-p']
5/5,Lovely place.  Good standards maintained. Good food also. Parking not sufficient for the size of that facility but once you are settled in you are well taken care of,[]
4/5,The hotel is one of the five star ⭐ hotel in LagosNice location with clean environment.. service is good,"['https://lh5.googleusercontent.com/p/AF1QipPLtaCbyUZmWOLBKPyF4n4T92NIX974ISV7qI2Y=w150-h150-k-no-p', 'https://lh5.googleusercontent.com/p/AF1QipOUHuX0lnNFphiWhXBnHijyTSfdAP4AzQ3EFha0=w150-h150-k-no-p', 'https://lh5.googleusercontent.com/p/AF1QipOXm1u-Aq_fXXcEuzfYB8gxJv84e1a4SqSyqama=w150-h150-k-no-p', 'https://lh5.googleusercontent.com/p/AF1QipOe23BihilVW9uuYMGWYdErA0CusZzYSo0eEVOD=w150-h150-k-no-p']"
4/5,"Very cozy and expensive hotel but I like their setting, style of furniture, interiors, food and even cutleries are inviting. They have in-house chefs and a varieties of local and intercontinental dishes. They have several halls for events and can host several events in a day, its a home to many topnotch events in Lagos especially with the entertainment industry. The structure is sitting over the Atlantic ocean, you could view the sea from your room. Their parking space is big and well planned, there are security men to help you park and parking is free.",[]
5/5,"It was a Wedding Reception, so we used one of the halls",[]
5/5,Basically has everything uld need,[]
5/5,It's a cool place to be. I enjoyed every minute of my stay there.,[]
5/5,Really serene environment,[]
4/5,"If you have the dough, then you will certainly enjoy your stay. The water view is lovely and so is the swimming pool. Only snare is that ordered food takes forever to arrive!",[]
4/5,The room was massive and nice. I had killed rice and goat meat sauce plus Asun. I enjoyed the meals very well. Staff were great and very helpful. There's a bureau de change downstairs.,[]
4/5,My stay at Lagos Oriental Hotel was good.I however had an event and the account manager forgot it was that day. It took them over 3 hours to have the place set up and i found this embarrassing as guest were waiting.One thing i loved there was the chinese rice and other chops. The food is massive😂 You will eat to your satisfaction and keep for the next day and it is equally tasty.The ambience is great and i loved that my room allowed me look over the toll gate.The other restaurant was just by the seaside and i really enjoyed the ambience it brought.,[]
5/5,"Good environment, with excellent panoramic views from the Lagos cowerie water ways to Lagos-Lekki-Ajah Express way, and the Oniru Estate....etc",[]
4/5,Lovely environment! Very enormous... the halls can be used for any kind of events ranging from weddings to ceremony etc. lovely food I must say though a little bit pricey,"['https://lh5.googleusercontent.com/p/AF1QipMpbrS9RaD9HsfUGAS6EUh-YpqTp3sxvdHNQQmj=w150-h150-k-no-p', 'https://lh5.googleusercontent.com/p/AF1QipMxWiIrolU752B3jM3SmXVVVsbMJJ5SELb9-nOb=w150-h150-k-no-p']"
4/5,"Hi!!The outdoor is quite spacious, so you don't have to worry about a place to park your car.",[]
3/5,"Although, not the most practical of location, it's nice and has a quiet and very calm environment. Very courteous staff, great meeting facilities and in a serene environment with so much noise :( I enjoyed a lot here.",[]
4/5,"This hotel is for the rich alone, it a 5star hotel very nice and cozy, but just make sure you have enough money to spend, and trust me the money is always worth it, this hotel is situated in one of the best cities in lagos just along the express way close to lekki toll gate, beautiful site to behold, clean environment, has spa, enjoy sweet jacuzzi bath, get your self a massage in one of the spa,  no need to worry about getting your hair done as there is a very cool saloon inside it, base on 5star level everything is just complete and sharp sharp😁. Their conferences room is so cool and relaxing, one of those conferences room you can have a seminar or meeting in and feel relax. Very nice, it was my first time there I really had a good time. And to think i had to go back for another good time, the chef are really good, their food are so nice, cozy Chinese restaurant they have there, i enjoyed every meal ordered","['https://lh5.googleusercontent.com/p/AF1QipOf2pk5s3cmA93icUpcNFEGjGcM8GmAhiCGxI8x=w150-h150-k-no-p', 'https://lh5.googleusercontent.com/p/AF1QipO2d__JkOlYrDva5EDVBLi7JwfM1OwPybvUtj5t=w150-h150-k-no-p', 'https://lh5.googleusercontent.com/p/AF1QipO9qCMm_-uYKK4YWPsBp4cyr7rizh82fm5s7DHL=w150-h150-k-no-p', 'https://lh5.googleusercontent.com/p/AF1QipNCdfZ-oyUV3xr6GaS0qeR_kqfJ4uggZEg_bP3t=w150-h150-k-no-p']"
2/5,Incredible! I left my house to relax in Oriental Hotel for 2 nights. I am just hearing that they have not subscribed to the dstv package that will enable guests to watch the English Premiership on SS3! What a black mark.I don't think I'll ever come back here.,[]
3/5,"The decor and ambience is superb, the service was great but their organisation could be greatly improved. Food is top-notch. Security needs to be more professional.",[]
3/5,"I think this hotel is a three star hotel. But then, it's well sited. In short, I love the location cuz it is on the water side. So for site seeing, this is the hotel. The water view here attracts clients a lot to this hotel. It's in a very strategic place.An upscale hotel with Chinese restaurant, Japan restaurant and big halls for occasions.",[]
5/5,"They have nice halls for events, a wonderful environment and a great service",[]
4/5,Good and classy environment. Food also very good. But need work on customer management,[]
5/5,"The real 5star hotel in Lagos.  The staffs professionalism and respectfulness is next to none.Oh, the menu..  the view…  the atmosphere",[]
5/5,"Serene atmosphere, with a bit of everything you could ever need.","['https://lh5.googleusercontent.com/p/AF1QipNLOWD4qxBkLeVS4af8_meZ5XOYVGKcdHxLPu7c=w150-h150-k-no-p', 'https://lh5.googleusercontent.com/p/AF1QipPLbrc9XRBwoN1eA_tQfQhzkjQ6EsneL_0fzN0d=w150-h150-k-no-p', 'https://lh5.googleusercontent.com/p/AF1QipOY2T2MBQX7RNYqpof-LOywmB0itaaVqEi0rjrp=w150-h150-k-no-p', 'https://lh5.googleusercontent.com/p/AF1QipON9mx0e63_uA85w717FttbjVxFPbEPpAeAl-K1=w150-h150-k-no-p']"
4/5,"It has class but the staffs need to sit up especially the housekeeping because while I was there, the room got cleaned and the items that were removed like the towel and bath gel, were not replaced. I called housekeeping but no one answered. Called reception and was told they'll pass the the info. Until the next morning before I got attended to.","['https://lh5.googleusercontent.com/p/AF1QipP18T9sIzyZ5-jXqw23AeECCjz259vGyGm4N8F_=w150-h150-k-no-p', 'https://lh5.googleusercontent.com/p/AF1QipPTn9zzsnBLXfCWmngFAGP4_GXmJeWk6McgBiiy=w150-h150-k-no-p', 'https://lh5.googleusercontent.com/p/AF1QipPjU2Y5TOWKOqEMRuJ3e8eILn6OjXR27P6tGL05=w150-h150-k-no-p']"
4/5,A perfect place to host a classy Lagos party.,"['https://lh5.googleusercontent.com/p/AF1QipOA7HB0wuHY-otHG1V5af7n5exM8n-j7l3zvZWd=w150-h150-k-no-p', 'https://lh5.googleusercontent.com/p/AF1QipM3TTRV20MRfgY6ZlYab2kYYLinhZj9KBs6D1ZE=w150-h150-k-no-p']"
4/5,It's fun being here. Seren environment and well coodinated.  I will love to be here again,[]
5/5,The view from the rooms are amazing! Breakfast is omgggggg Awesome! My friends and I loved our stay here during our visit to Nigeria! Will definitely come back☺️👍🏽,[]
5/5,A very nice place to visit,[]
5/5,This hotel is without any doubt one of the biggest and finest in the Victoria Island axis of Lagos.The edifice stands out along the Ozumba Nbadiwe drive.Very conspicuous upon entering this hotel are beautiful chandeliers hanging all over the place.One wing of the hotel serves as office space while the other serves as the hotel proper.The hotel has got very big show/event/conference rooms and it’s also got a very appealing restaurant.,[]
4/5,Went for massage at ORIKI and lunch at the chinese on 3rd floor.. easy to park and all used amenities were good.,[]
4/5,"The hotel is an amazing place  to relax  and unwind, the chinese and japanese cuisine is so on point. I must also add that the lightning is great,  of you get to use the stairs they got this lovely chandelier. Enough said,  go there already",[]
5/5,"Fine dining, halls for events like book launch, weddings, round table events and conferences etc",[]
5/5,"Awesome place with great facilities, nice oceans views, and finally the structure of the hotel is dope",[]
4/5,"It's basically a Chinese hotel, with Chinese themes and food and all. The view by the lagoon is stunning. The rooms are big. The bathroom is ok. The tv choices are lousy. The price is too much. I like the hotel, but not for this price. Other cleaner and better hotels are cheaper. In moving out.",[]
4/5,"I was here for the 2nd Annual Peace & Unity Conference (Lagos) with lectures from Mufti Menk, Hajia Salatu Sule and a host of others.So of course, I don't have the lodging experience, just a conference or workshop experience.The hotel looked beautiful, serene and quite fanciful. The hall was quite large and the facility is well taken care of. The veiw from the very large terrace (which I've heard doubles as an helipad) is beautiful and it overlooked a waterbody that was calm but had some waterway traffic and activity. We said our prayers here.Cars are able to drive in and drop guest right at the lobby then proceed to a parking area.It is a well managed hotel and I look forward to an actual lodging experience here.","['https://lh5.googleusercontent.com/p/AF1QipMllX06ztDn8PUaPymlxI42BQM0VpPMzMArEeJ2=w150-h150-k-no-p', 'https://lh5.googleusercontent.com/p/AF1QipPW4ls3ByoZsuayemyj7SbcNxcxCxjH13aaYmNW=w150-h150-k-no-p', 'https://lh5.googleusercontent.com/p/AF1QipP1F9oznue8flxAHkBpo_jpncEUIWU83SfKriuv=w150-h150-k-no-p']"
4/5,"Oriental Hotel is a one stop home away from home.It is located at sand fields VI Lagos.Customer service is top notch.Within the hotel there are different restaurants and bars. Chinese, Japanese etc. And the food is amazing.The hotel has never Area for meeting and it very close to the waterside, they have this amazing swimming pool at the the back of the building.I hereby recommend Oriental Hotels.","['https://lh5.googleusercontent.com/p/AF1QipOpdVxDNncVccFDIkFRH05SqCrWPy_g75ONmyLV=w150-h150-k-no-p', 'https://lh5.googleusercontent.com/p/AF1QipPBLV_dA-FuHZaBgEixtC-g8jrRIglh-_77e40e=w150-h150-k-no-p', 'https://lh5.googleusercontent.com/p/AF1QipPqmDgxjC-71krikInSViUtV5eQ-90e229HDJrW=w150-h150-k-no-p', 'https://lh5.googleusercontent.com/p/AF1QipOGjTnN-hlrD1ux37uq58K8Mha1WnbUvieHLZFa=w150-h150-k-no-p']"
5/5,Such a nice place,[]
5/5,"Wow!!!!! I love everything about this hotel!! Excellent service, warm reception from staff meeting, tasty meals...... I can go on. Meanwhile, Look out for the gorgeous painting that greets you on your arrival.",[]
5/5,Well organised. They serve delicious food. They have quality chef 👌,[]
5/5,This Asian themed hotel boasts of luxury and grandeur.It's located in upscale area of Lagos Island at the lagoon edge and overview of Ikoyi link Bridge.The restaurant major in Chinese meals. Continental dishes also available.Rooms a well spacious and neat.Bathrooms are wider than you'd anticipate.On the downside; the TVs are old. Light fittens are made awkward with the replacements used. And the walkway to the rooms are too quiet.Enjoyed my stay tho,"['https://lh5.googleusercontent.com/p/AF1QipOhQOnXFoU3BPbXMI-BAU6Z_BD7T3_8wA2kimSX=w150-h150-k-no-p', 'https://lh5.googleusercontent.com/p/AF1QipNsrr6tgIkDUJtG5qrXx-KmVnuq-Q73b52B08ya=w150-h150-k-no-p', 'https://lh5.googleusercontent.com/p/AF1QipNaAoQj_NKPY2yS5M4dIkFiRtjNj9KTPInCnhbP=w150-h150-k-no-p', 'https://lh5.googleusercontent.com/p/AF1QipO_D6RYJxgsR5C5fcFQPcUNkLgISEqZ9OdzyPd2=w150-h150-k-no-p']"
5/5,Beautiful place. The halls are properly air conditioned and would suffice for almost any kind of event. The view of the ocean makes it worthwhile.,[]
5/5,"One of the most expensive and biggest hotels in Lagos state, beautiful and exciting","['https://lh5.googleusercontent.com/p/AF1QipPfAXswXtrtjYGSC_7LP-onww42TnewD2yvAW59=w150-h150-k-no-p', 'https://lh5.googleusercontent.com/p/AF1QipPX_zgdsW731BzGKJv2LUFEuvaa7I0CcxNGMORw=w150-h150-k-no-p', 'https://lh5.googleusercontent.com/p/AF1QipO78fvx8H41vSaC5ffTsXbIFbFmnz7XhaglPl5q=w150-h150-k-no-p', 'https://lh5.googleusercontent.com/p/AF1QipP6HjISu3zQ3zPuhgjcDjdaErPuQMCnpmJyNtM_=w150-h150-k-no-p']"
5/5,Lovely place for comfort. Great environment with good staff.Except for the access and exit gates which are manually controlled by gate guards every other thing is beautiful,[]
4/5,Nice Ambience. Friendly Service,[]
5/5,Always a pleasure coming back to the oriental the rooms are huge and the decor very tasteful. Thier continental breakfast is also enjoyable and you get a nice view from the top.,[]
5/5,"Just left there, the ambiance is graceful. Good place for great conference.Went for AOT 3.0","['https://lh5.googleusercontent.com/p/AF1QipMHPZEiJxoxgiQnznwLAddTo3y4lpq5qldNgCJw=w150-h150-k-no-p', 'https://lh5.googleusercontent.com/p/AF1QipNFfrRZx3oK0uuKjRVUzEKx1t-weIF7prA53oNT=w150-h150-k-no-p', 'https://lh5.googleusercontent.com/p/AF1QipO4UAorC2icPAgVXmKY65laVIDzOUfSA46nb8SF=w150-h150-k-no-p']"
4/5,"One of the most popular hotel on the Island, it has a pleasing structure while viewing from the outside.On the inside, it has this classic elegant ambience to it compare to Radisson Blu and others with a modern approach.It's mostly  visited by expatriates and business executives",[]
4/5,Its a place of high luxury  and their services are best to none. Nice environment where you can have a nice view of the  immediate environment . Its has a very nice bar and restaurant where you can eat intercontinental  meals. Secured environment  with a enough parking space.,[]
4/5,"Nice hotel.Neat rooms, everything works.The staff are cordial.Nice complimentary breakfast on the 4th floor which has a beautiful view of the ocean and metropolitan city of Lagos.",[]
4/5,Thoroughly enjoyed our stay. Everything was on point save for the breakfast buffet which should be improved on.,[]
4/5,"Beautiful Hotel but insufficient number of Guests Lifts, Largest and generous Hotel Rooms one can't find anywhere in the world. Value for money accommodation. Largest Bathrooms ever found anywhere in the world.",[]
5/5,"I had been there before to covered event as a video cameraman,their biggest and longest hall were so fantastic for my work.The ambience is so inviting and always welcoming all visitors.",[]
3/5,"Big continental hotel.Rooms are nice, only passage looks like dull.Nice back water view and open place at rearside of the hotel.Baggage assistance is good.Complementary breakfast.Parking place is available.",[]
4/5,"LOH is very classic and also has very great view. Well I particularly love  because it just before the toll gate entrance. The restaurants are open to one time guests and lodgers. There is also a swimming pool bar(not sure if you can swim if you are not logded there) a coffee shop, a Chinese restaurant and an interesting restaurant that you cook your meal from scratch... I find that very special. We didn't lodge so I can say anything about the rooms for now. But we had a sumptuous dinner and smoothie. The one time guests restroom wasn't clean at all and didn't smell nice (maybe it's just today but I got to see that, not nice) Well I will still recommend LOH anytime though hence the 4 stars, maybe I will give 5 stars at our next visit, hopefully.",[]
4/5,It a nice place to hang out,[]
4/5,"The Lagos Oriental Hotel is located just before the Lekki first toll gate after Law School. Quite big and spacious, with multi-floor car park and rooms overlooking the Lagoon waterfront. They've very big event halls and other fanciful shops operating there. Can't say much about their accommodation or menu but I'm so sure you can't escape the Chinese cuisine here. By and large its an environment you would like to relax in away from hustle and bustle of the Lagos traffic.",[]
2/5,"The parking arrangement of this hotel is excruciatingly painful. To gain access to the car park can take you two hours as the road is very narrow. It's just messy, especially when they have an event taking place. By the time you are in, you will want to shoot someone.",[]
5/5,Ambience extraordinary. Well strategic location. Luxury and class.,[]
5/5,"Beautiful place, very classy, high standards it has every facility you'd think of. Swimming pool, ocean views, lovely room service, bar, lounge, parking space and easy accessibility.","['https://lh5.googleusercontent.com/p/AF1QipN_YMzByQ3emyoJ3UTOicG8VECSBSLDRqHTgEXd=w150-h150-k-no-p', 'https://lh5.googleusercontent.com/p/AF1QipNhCHYIZgb38LbwKi3IlVY-wx92MBbPsi-syWPi=w150-h150-k-no-p', 'https://lh5.googleusercontent.com/p/AF1QipNlbCjDExInEIqdTSUDuDuCOu6vycfCSgK6wsGi=w150-h150-k-no-p', 'https://lh5.googleusercontent.com/p/AF1QipMK1KrmH0ai_5mvuUtQ3VRbBRAbGDggdD2Bjb9f=w150-h150-k-no-p']"
3/5,"Get some real flowers please, the place looks so dead. It's a nice place to stay but the services are sometimes delayed...guess they have few staff.The staff are friendly, smart while some are very unprofessional.",[]
5/5,A beautiful edifice. Home away from home.I used to think it would be very expensive to hold an event here. I changed my mind when  a birthday bash for my wife @55 for ten persons cost less than  150USD.A PLACE TO BE.,[]
5/5,"Really beautiful place, warm staff and good food. I couldn't have asked for more.","['https://lh5.googleusercontent.com/p/AF1QipMPVEtiS-S9i6FwByfTT6J5ifBtL_t6mOfFm2qj=w150-h150-k-no-p', 'https://lh5.googleusercontent.com/p/AF1QipMN_qIx4w3oNw3DUANp2SrAdl6mYTaPuPCTqAhC=w150-h150-k-no-p']"
5/5,"The Lagos Continental Hotel is a 5-Star hotel situated in the popular high-brow area of Lagos, at Plot 52, Kofo Abayomi Street, Victoria Island, Lagos, Nigeria. It offers expansive luxury and tastily furnished rooms.It is rated among the tallest hospitality building in Nigeria. With this height, it offers splendid views of the Lagos city, especially the islands and Lekki pennisula environment.It is a stone throw from exclusive & popular social clubs, cinemas and embassies.",[]
3/5,"Not too bad but why is there no urinal at the first floor gent in stead of the normal conventional WC system? For a standard hotel of that nature, I think its not good enough.",[]
5/5,Excellent business hotel in the bustling Victoria Island. The hotel has three authentic asian restaurants and few selection of Nigerian and continental cuisine with affordable cost. The view in the pool side is breathtaking that surely releases your stress. A must try when in Lagos.,['https://lh5.googleusercontent.com/p/AF1QipOuhJ-ytJPrM-GGhvrSM5frWyxBRyhXe24ZZTpu=w150-h150-k-no-p']
5/5,Serene ambience...Soul lifting,"['https://lh5.googleusercontent.com/p/AF1QipOjqbKuuRh_KTvmDA9nLg6q7x5CVxP-HhCNIOQ8=w150-h150-k-no-p', 'https://lh5.googleusercontent.com/p/AF1QipNvtLyYZ5HBKpTx83nRfWgBi7tMPp9543i2p44V=w150-h150-k-no-p']"
5/5,A good hotel. Meets international standards.,[]
5/5,"great ambience. close to the palms shopping mall. central to both Victoria island and lekki. offers great accommodation,  food and has a large hall for events and dinner parties plus receptions. Also has great cuisine and restaurants. serving both continental and oriental dishes",[]
4/5,"Great place, nice ambience, quality",[]
4/5,"Oriental Hotel is a top rate luxury hotel in the middle of VI! Luxury rooms, great service and really good food!They also have halls for events and great restaurants for fine dining; the parking is not too bad, too.",[]
1/5,"The environment is ok but their food is not ok most especially their fried rice, terrible.. they don't have enough toiletries, no toothbrush & paste but the workers are professional and friendly..",[]
